{
  "$schema": "https://json-schema.org/draft/2020-12/schema",
  "$id": "https://flex.dev/schemas/descriptor.v1alpha1.schema.json",
  "title": "CP-1/CP-3 FlexNodeDescriptor v1alpha1 (release descriptor)",
  "description": "Config blob (mediaType application/vnd.flex.node.descriptor.v1+json) of a flexNode release manifest, written by `flex release` (flexmodel/release/pipeline.py) and the probe release tools. It is covered by the release signature (the manifest digest). The engine reads only: safetyClass, interfaceHash, health, restartPolicy, runOptions, plc.download; the other fields are owned by the release tool and typed loosely here.",
  "$comment": "Health spec, restart policy and run options live here (signed), not in the desired state: the cloud cannot widen them. Additive-only within v1alpha1. Unknown keys allowed (release-tool owned) except unregistered x- keys; registered: x-flex-mcu.",
  "type": "object",
  "required": ["apiVersion", "kind", "module", "releaseVersion", "profiles"],
  "propertyNames": {"anyOf": [{"not": {"pattern": "^x-"}}, {"enum": ["x-flex-mcu"]}]},
  "properties": {
    "apiVersion": {"const": "flex.dev/v1alpha1"},
    "kind": {"const": "FlexNodeDescriptor"},
    "module": {"type": "string", "minLength": 1},
    "moduleVersion": {"type": "string"},
    "releaseVersion": {"type": "string", "minLength": 1},
    "interfaceHash": {"type": ["string", "null"], "pattern": "^FLEX(01|SYS01)_[0-9a-f]{64}$", "description": "FLEX01 interface hash (FLEXSYS01 for a system record). Reported as status.interfaceHash; preflight compares it with the payload (mcu-module header, plc-verify spec). null for a base-image (mcu-firmware) release."},
    "language": {"type": "string"},
    "profiles": {"type": "array", "minItems": 1, "items": {"enum": ["container", "native", "applab", "mcu-module", "mcu-firmware", "plc-verify", "system"]}, "description": "Driver profiles this release has payload layers for; 'system' is a record-only composite release (no driver deploys it). The engine selects the layer by its dev.flex.profile annotation (CP-3)."},
    "safetyClass": {"enum": ["none", "safety-relevant"], "description": "Model-derived (flex safety). Must equal the deployment's x-flex-safetyClass (default none), else the engine rejects the manifest."},
    "safetyClassSource": {"type": "string"},
    "health": {"$ref": "#/$defs/HealthProbe"},
    "restartPolicy": {"$ref": "#/$defs/RestartPolicy"},
    "runOptions": {"$ref": "#/$defs/RunOptions"},
    "plc": {
      "type": "object",
      "properties": {
        "download": {"const": false, "description": "plc-verify refuses a release that asks for a PLC download (decision 2026-10-16)."},
        "runtime": {"type": "string"},
        "verify": {"type": "object"},
        "note": {"type": "string"}
      }
    },
    "x-flex-mcu": {"$ref": "#/$defs/McuFacts"},
    "parameters": {"type": "array", "description": "Module parameter declarations from the model (not yet checked against deployment parameters: EV-25)."},
    "ports": {"type": "array"},
    "composite": {"type": ["object", "array"], "description": "Members of a composite release (App Lab app, PLC bridge, system); checked by flexCloud against the model."}
  },
  "$defs": {
    "HealthProbe": {
      "type": "object",
      "additionalProperties": false,
      "description": "Health gate spec. The engine runs drv.health(dep, probe) every periodSeconds; the gate passes after successThreshold consecutive successes once minSeconds have passed (forward installs only), fails at timeoutSeconds or at once when the driver reports a terminal failure (fail-fast). Engine defaults when absent: successThreshold 1, periodSeconds 0.25, timeoutSeconds 10, minSeconds 0.",
      "properties": {
        "type": {"enum": ["http", "mcu-heartbeat", "mcu-base", "applab-handshake", "plc-hash"], "description": "Informational: what the profile's driver checks (drivers do not dispatch on it)."},
        "port": {"oneOf": [{"type": "integer", "minimum": 1, "maximum": 65535}, {"type": "string", "pattern": "^\\$\\{[A-Z_][A-Z0-9_]*\\}$"}], "description": "http: container port probed on the container IP (default 8080). The native driver allocates the port itself and passes it as FLEX_HEALTH_PORT, so native releases say \"${FLEX_HEALTH_PORT}\"."},
        "path": {"type": "string", "pattern": "^/", "description": "http: path (default /healthz); 2xx = healthy."},
        "periodSeconds": {"type": "number", "exclusiveMinimum": 0},
        "successThreshold": {"type": "integer", "minimum": 1},
        "timeoutSeconds": {"type": "number", "exclusiveMinimum": 0},
        "minSeconds": {"type": "number", "minimum": 0, "description": "Soak: commit only after the workload was observed healthy this long (MCU confirm window)."}
      }
    },
    "RestartPolicy": {
      "type": "object",
      "additionalProperties": false,
      "description": "Local supervision. container: docker/podman --restart (always -> unless-stopped, never -> no, else on-failure:maxRetries); Ankaios ALWAYS/NEVER/ON_FAILURE; native: Restart= semantics with RestartSec and a start limit (maxRetries within 60 s). Empty = driver default (on-failure, 5).",
      "properties": {
        "policy": {"enum": ["on-failure", "always", "never"]},
        "maxRetries": {"type": "integer", "minimum": 0},
        "restartSec": {"type": "number", "minimum": 0}
      }
    },
    "RunOptions": {
      "type": "object",
      "additionalProperties": false,
      "description": "Extra docker/podman run options (container profile only, not Ankaios). Every value must be on the device's allow-list (engine config drivers.container.allowedRunOptions), else apply fails.",
      "properties": {
        "devices": {"$ref": "#/$defs/StrOrList", "description": "--device"},
        "gpus": {"$ref": "#/$defs/StrOrList", "description": "--gpus"},
        "runtime": {"$ref": "#/$defs/StrOrList", "description": "--runtime"},
        "groupAdd": {"$ref": "#/$defs/StrOrList", "description": "--group-add"}
      }
    },
    "StrOrList": {"oneOf": [{"type": "string"}, {"type": "array", "items": {"type": "string"}}]},
    "FlxmFacts": {
      "type": "object",
      "description": "FLXM v1 header facts of one module build (flxm.Header.to_dict()).",
      "required": ["abi", "arch", "floatAbi"],
      "properties": {
        "name": {"type": "string"}, "version": {"type": "string"},
        "abi": {"type": "string", "pattern": "^[0-9]+\\.[0-9]+$"},
        "arch": {"enum": ["armv7m", "armv8m.main"]},
        "floatAbi": {"enum": ["soft", "hard"]},
        "caps": {"type": "array", "items": {"enum": ["pwm", "localbus", "heap", "fpu", "zenoh"]}},
        "elfSize": {"type": "integer"}, "ramEstimate": {"type": "integer"}, "stepPeriodMs": {"type": "integer"},
        "testWindowMs": {"type": "integer"},
        "interfaceHash": {"type": "string", "pattern": "^FLEX01_[0-9a-f]{64}$"},
        "elfSha256": {"type": "string", "pattern": "^[0-9a-f]{64}$"}
      }
    },
    "McuFacts": {
      "description": "Informational MCU facts (the engine does not read them; preflight reads the FLXM header itself). Three shapes exist today: per CPU profile (flex release, multi-arch), flat (probe P3 release tool, single build), base-image facts (mcu-firmware).",
      "oneOf": [
        {"$ref": "#/$defs/FlxmFacts"},
        {"type": "object", "required": ["bootloader"], "properties": {"bootloader": {"type": "string"}, "board": {"type": "string"}, "moduleAbi": {"type": "string"}}},
        {"type": "object", "minProperties": 1, "propertyNames": {"pattern": "^[a-z0-9.-]+$", "not": {"enum": ["bootloader", "abi", "arch", "floatAbi"]}}, "additionalProperties": {"$ref": "#/$defs/FlxmFacts"}}
      ]
    }
  }
}
